{
  "schema_version": "1.0",
  "title": "Ainda Uma Vez",
  "composer": "Francisco Jose Barbosa Condi",
  "key": "Cm",
  "key_sig": -3,
  "bpm": "75-85",
  "meter": "4/4",
  "clef": "treble",
  "pipeline_version": "v5.1",
  "generated_at": "2026-04-27T01:26:16.748703+00:00",
  "sections": [
    {
      "id": "intro",
      "label": "Intro",
      "lines": [
        {
          "id": "instrumental_1",
          "measures": [
            {
              "n": 1,
              "x0": 51.8,
              "x1": 227.7,
              "chords": [
                {
                  "symbol": "Cm",
                  "beat": 2,
                  "beat_ratio": 0.284,
                  "protocol": {
                    "cx": 101.8,
                    "rule": "VAZIO",
                    "syllable": null,
                    "syllable_cx": null,
                    "float_cx": 101.7540417232648,
                    "next_syllable": null,
                    "next_syllable_cx": null,
                    "nota_anchor": null
                  },
                  "human": null,
                  "ground_truth": {
                    "status": "unvalidated",
                    "correct": null,
                    "delta_cx": null,
                    "correction_type": null,
                    "rule_changed": null,
                    "implied_rule": null
                  }
                },
                {
                  "symbol": "Ab",
                  "beat": 4,
                  "beat_ratio": 0.787,
                  "protocol": {
                    "cx": 190.2,
                    "rule": "VAZIO",
                    "syllable": null,
                    "syllable_cx": null,
                    "float_cx": 190.21518380235443,
                    "next_syllable": null,
                    "next_syllable_cx": null,
                    "nota_anchor": null
                  },
                  "human": null,
                  "ground_truth": {
                    "status": "unvalidated",
                    "correct": null,
                    "delta_cx": null,
                    "correction_type": null,
                    "rule_changed": null,
                    "implied_rule": null
                  }
                }
              ],
              "notes": [],
              "syllables": [],
              "beats_used": 0.0
            },
            {
              "n": 2,
              "x0": 227.7,
              "x1": 334.4,
              "chords": [
                {
                  "symbol": "Fm",
                  "beat": 2,
                  "beat_ratio": 0.478,
                  "protocol": {
                    "cx": 278.7,
                    "rule": "VAZIO",
                    "syllable": null,
                    "syllable_cx": null,
                    "float_cx": 278.72721486945545,
                    "next_syllable": null,
                    "next_syllable_cx": null,
                    "nota_anchor": null
                  },
                  "human": null,
                  "ground_truth": {
                    "status": "unvalidated",
                    "correct": null,
                    "delta_cx": null,
                    "correction_type": null,
                    "rule_changed": null,
                    "implied_rule": null
                  }
                }
              ],
              "notes": [],
              "syllables": [],
              "beats_used": 0.0
            },
            {
              "n": 4,
              "x0": 336.7,
              "x1": 460.0,
              "chords": [
                {
                  "symbol": "G",
                  "beat": 2,
                  "beat_ratio": 0.314,
                  "protocol": {
                    "cx": 375.4,
                    "rule": "VAZIO",
                    "syllable": null,
                    "syllable_cx": null,
                    "float_cx": 375.4094885217323,
                    "next_syllable": null,
                    "next_syllable_cx": null,
                    "nota_anchor": null
                  },
                  "human": null,
                  "ground_truth": {
                    "status": "unvalidated",
                    "correct": null,
                    "delta_cx": null,
                    "correction_type": null,
                    "rule_changed": null,
                    "implied_rule": null
                  }
                }
              ],
              "notes": [],
              "syllables": [],
              "beats_used": 0.0
            },
            {
              "n": 5,
              "x0": 460.0,
              "x1": 552.5,
              "chords": [
                {
                  "symbol": "Cm",
                  "beat": 1,
                  "beat_ratio": 0.149,
                  "protocol": {
                    "cx": 473.8,
                    "rule": "VAZIO",
                    "syllable": null,
                    "syllable_cx": null,
                    "float_cx": 473.79154232326476,
                    "next_syllable": null,
                    "next_syllable_cx": null,
                    "nota_anchor": null
                  },
                  "human": null,
                  "ground_truth": {
                    "status": "unvalidated",
                    "correct": null,
                    "delta_cx": null,
                    "correction_type": null,
                    "rule_changed": null,
                    "implied_rule": null
                  }
                }
              ],
              "notes": [],
              "syllables": [],
              "beats_used": 0.0
            }
          ]
        },
        {
          "id": "instrumental_2",
          "measures": [
            {
              "n": 1,
              "x0": 51.8,
              "x1": 227.7,
              "chords": [
                {
                  "symbol": "Ab",
                  "beat": 2,
                  "beat_ratio": 0.25,
                  "protocol": {
                    "cx": 95.9,
                    "rule": "T90.3_PAUSA",
                    "syllable": null,
                    "syllable_cx": null,
                    "float_cx": 95.87710280235441,
                    "next_syllable": null,
                    "next_syllable_cx": null,
                    "nota_anchor": "Œ@100"
                  },
                  "human": null,
                  "ground_truth": {
                    "status": "unvalidated",
                    "correct": null,
                    "delta_cx": null,
                    "correction_type": null,
                    "rule_changed": null,
                    "implied_rule": null
                  }
                },
                {
                  "symbol": "Fm",
                  "beat": 4,
                  "beat_ratio": 0.837,
                  "protocol": {
                    "cx": 199.0,
                    "rule": "VAZIO",
                    "syllable": null,
                    "syllable_cx": null,
                    "float_cx": 199.00489326945544,
                    "next_syllable": null,
                    "next_syllable_cx": null,
                    "nota_anchor": "œ@208"
                  },
                  "human": null,
                  "ground_truth": {
                    "status": "unvalidated",
                    "correct": null,
                    "delta_cx": null,
                    "correction_type": null,
                    "rule_changed": null,
                    "implied_rule": null
                  }
                }
              ],
              "notes": [
                {
                  "cx": 100.4,
                  "note": "Sib5",
                  "midi": 82,
                  "figure": "pausa_semínima",
                  "beats": 1.0,
                  "is_rest": true,
                  "flags": 0
                },
                {
                  "cx": 119.7,
                  "note": "Dó5",
                  "midi": 72,
                  "figure": "semínima",
                  "beats": 1.0,
                  "is_rest": false,
                  "flags": 0
                },
                {
                  "cx": 133.2,
                  "note": "Ré5",
                  "midi": 74,
                  "figure": "semínima",
                  "beats": 1.0,
                  "is_rest": false,
                  "flags": 0
                },
                {
                  "cx": 146.4,
                  "note": "Mib5",
                  "midi": 75,
                  "figure": "semínima",
                  "beats": 1.0,
                  "is_rest": false,
                  "flags": 0
                },
                {
                  "cx": 164.9,
                  "note": "Sol5",
                  "midi": 79,
                  "figure": "semínima",
                  "beats": 1.0,
                  "is_rest": false,
                  "flags": 0
                },
                {
                  "cx": 189.8,
                  "note": "Dó5",
                  "midi": 72,
                  "figure": "semínima",
                  "beats": 1.0,
                  "is_rest": false,
                  "flags": 0
                },
                {
                  "cx": 208.2,
                  "note": "Dó5",
                  "midi": 72,
                  "figure": "semínima",
                  "beats": 1.0,
                  "is_rest": false,
                  "flags": 0
                },
                {
                  "cx": 221.6,
                  "note": "Ré5",
                  "midi": 74,
                  "figure": "semínima",
                  "beats": 1.0,
                  "is_rest": false,
                  "flags": 0
                }
              ],
              "syllables": [],
              "beats_used": 7.0
            },
            {
              "n": 2,
              "x0": 227.7,
              "x1": 334.4,